<?xml version="1.0"?>
<!DOCTYPE alphabets SYSTEM "alphabet.dtd">
<?xml-stylesheet type="text/xsl" href="alphabet.xsl"?>
<alphabets langcode="ig">
<alphabet name="Igbo with punctuation and numerals">
<orientation type="LR"/>
<encoding type="Western"/>
<control d="Control" t=""/>
<palette>Default</palette>
<train>training_Igbo_NG.txt</train>
<space d="&#x25a1;" t=" " b="9" />
<paragraph d="&#182;" b="9"/>
<group name="lower case letters" b="0">
<s d="&#x0061;" t="&#x0061;" />
<s d="&#x0062;" t="&#x0062;" />
<s d="&#x0063;" t="&#x0063;" />
<s d="&#x0064;" t="&#x0064;" />
<s d="&#x0065;" t="&#x0065;" />
<s d="&#x0066;" t="&#x0066;" />
<s d="&#x0067;" t="&#x0067;" />
<s d="&#x0068;" t="&#x0068;" />
<s d="&#x0069;" t="&#x0069;" />
<s d="&#x1ECB;" t="&#x1ECB;" />
<s d="&#x00EF;" t="&#x00EF;" />
<s d="&#x006A;" t="&#x006A;" />
<s d="&#x006B;" t="&#x006B;" />
<s d="&#x006C;" t="&#x006C;" />
<s d="&#x006D;" t="&#x006D;" />
<s d="&#x006E;" t="&#x006E;" />
<s d="&#x1E45;" t="&#x1E45;" />
<s d="&#x00F1;" t="&#x00F1;" />
<s d="&#x006F;" t="&#x006F;" />
<s d="&#x1ECD;" t="&#x1ECD;" />
<s d="&#x00F6;" t="&#x00F6;" />
<s d="&#x0070;" t="&#x0070;" />
<s d="&#x0071;" t="&#x0071;" />
<s d="&#x0072;" t="&#x0072;" />
<s d="&#x0073;" t="&#x0073;" />
<s d="&#x0074;" t="&#x0074;" />
<s d="&#x0075;" t="&#x0075;" />
<s d="&#x1EE5;" t="&#x1EE5;" />
<s d="&#x00FC;" t="&#x00FC;" />
<s d="&#x0076;" t="&#x0076;" />
<s d="&#x0077;" t="&#x0077;" />
<s d="&#x0078;" t="&#x0078;" />
<s d="&#x0079;" t="&#x0079;" />
<s d="&#x007A;" t="&#x007A;" />
</group> 
<group name="upper case letters" b="111"> 
<s d="&#x0041;" t="&#x0041;" />
<s d="&#x0042;" t="&#x0042;" />
<s d="&#x0043;" t="&#x0043;" />
<s d="&#x0044;" t="&#x0044;" />
<s d="&#x0045;" t="&#x0045;" />
<s d="&#x0046;" t="&#x0046;" />
<s d="&#x0047;" t="&#x0047;" />
<s d="&#x0048;" t="&#x0048;" />
<s d="&#x0049;" t="&#x0049;" />
<s d="&#x1ECA;" t="&#x1ECA;" />
<s d="&#x00CF;" t="&#x00CF;" />
<s d="&#x004A;" t="&#x004A;" />
<s d="&#x004B;" t="&#x004B;" />
<s d="&#x004C;" t="&#x004C;" />
<s d="&#x004D;" t="&#x004D;" />
<s d="&#x004E;" t="&#x004E;" />
<s d="&#x1E44;" t="&#x1E44;" />
<s d="&#x00D1;" t="&#x00D1;" />
<s d="&#x004F;" t="&#x004F;" />
<s d="&#x1ECC;" t="&#x1ECC;" />
<s d="&#x00D6;" t="&#x00D6;" />
<s d="&#x0050;" t="&#x0050;" />
<s d="&#x0051;" t="&#x0051;" />
<s d="&#x0052;" t="&#x0052;" />
<s d="&#x0053;" t="&#x0053;" />
<s d="&#x0054;" t="&#x0054;" />
<s d="&#x0055;" t="&#x0055;" />
<s d="&#x1EE4;" t="&#x1EE4;" />
<s d="&#x00DC;" t="&#x00DC;" />
<s d="&#x0056;" t="&#x0056;" />
<s d="&#x0057;" t="&#x0057;" />
<s d="&#x0058;" t="&#x0058;" />
<s d="&#x0059;" t="&#x0059;" />
<s d="&#x005A;" t="&#x005A;" />
</group>
<group name="Numbers" b="113">
<s d="1" t="1"/>
<s d="2" t="2"/>
<s d="3" t="3"/>
<s d="4" t="4"/>
<s d="5" t="5"/>
<s d="6" t="6"/>
<s d="7" t="7"/>
<s d="8" t="8"/>
<s d="9" t="9"/>
<s d="0" t="0"/>
</group>
<group name="Punctuation" b="112">
<s d="%" t="%"/>
<s d="*" t="*"/>
<s d="+" t="+"/>
<s d="=" t="="/>
<s d="/" t="/"/>
<s d="#" t="#"/>
<s d="$" t="$"/>
<s d="|" t="|"/>
<s d="\" t="\"/>
<s d="~" t="~"/>
<s d="^" t="^"/>
<s d="_" t="_"/>
<s d="&amp;" t="&amp;"/>
<s d="@" t="@"/>
<s d="[" t="["/>
<s d="]" t="]"/>
<s d="{" t="{"/>
<s d="}" t="}"/>
<s d="&lt;" t="&lt;"/>
<s d="&gt;" t="&gt;"/>
<s d="(" t="("/>
<s d=")" t=")"/>
<s d="&quot;" t="&quot;"/>
<s d="`" t="`"/>
<s d="&apos;" t="&apos;"/>
<s d="-" t="-"/>
<s d=":" t=":"/>
<s d=";" t=";"/>
<s d="?" t="?"/>
<s d="!" t="!"/>
<s d="," t=","/>
<s d="." t="."/>
</group>
</alphabet>
</alphabets>
