<?xml version="1.0"?>
<!DOCTYPE alphabets SYSTEM "alphabet.dtd">
<?xml-stylesheet type="text/xsl" href="alphabet.xsl"?>
<alphabets langcode="lv">
<alphabet name="Latvie&#353;u / Latvian with punctuation and numerals">
<orientation type="LR"/>
<encoding type="Western"/>
<palette>Default</palette>
<train>training_latvian_LV.txt</train>
<space d="&#x25a1;" t=" " b="9" />
<paragraph d="&#182;" b="9"/>
<control d="Control" t="" b="8"/>
<group name="lower case letters" b="0">
<s d="&#x0061;" t="&#x0061;"  note=" A "   />
<s d="&#x0101;" t="&#x0101;"  note=" A WITH MACRON "   />
<s d="&#x0062;" t="&#x0062;"  note=" B "   />
<s d="&#x0063;" t="&#x0063;"  note=" C "   />
<s d="&#x010D;" t="&#x010D;"  note=" C WITH CARON "   />
<s d="&#x0064;" t="&#x0064;"  note=" D "   />
<s d="&#x0065;" t="&#x0065;"  note=" E "   />
<s d="&#x0113;" t="&#x0113;"  note=" E WITH MACRON "   />
<s d="&#x0066;" t="&#x0066;"  note=" F "   />
<s d="&#x0067;" t="&#x0067;"  note=" G "   />
<s d="&#x0123;" t="&#x0123;"  note=" G WITH CEDILLA "   />
<s d="&#x0068;" t="&#x0068;"  note=" H "   />
<s d="&#x0069;" t="&#x0069;"  note=" I "   />
<s d="&#x012B;" t="&#x012B;"  note=" I WITH MACRON "   />
<s d="&#x0079;" t="&#x0079;"  note=" Y "   />
<s d="&#x006A;" t="&#x006A;"  note=" J "   />
<s d="&#x006B;" t="&#x006B;"  note=" K "   />
<s d="&#x0137;" t="&#x0137;"  note=" K WITH CEDILLA "   />
<s d="&#x006C;" t="&#x006C;"  note=" L "   />
<s d="&#x013C;" t="&#x013C;"  note=" L WITH CEDILLA "   />
<s d="&#x006D;" t="&#x006D;"  note=" M "   />
<s d="&#x006E;" t="&#x006E;"  note=" N "   />
<s d="&#x0146;" t="&#x0146;"  note=" N WITH CEDILLA "   />
<s d="&#x006F;" t="&#x006F;"  note=" O "   />
<s d="&#x014D;" t="&#x014D;"  note=" O WITH MACRON "   />
<s d="&#x0070;" t="&#x0070;"  note=" P "   />
<s d="&#x0071;" t="&#x0071;"  note=" Q "   />
<s d="&#x0072;" t="&#x0072;"  note=" R "   />
<s d="&#x0157;" t="&#x0157;"  note=" R WITH CEDILLA "   />
<s d="&#x0073;" t="&#x0073;"  note=" S "   />
<s d="&#x0161;" t="&#x0161;"  note=" S WITH CARON "   />
<s d="&#x0074;" t="&#x0074;"  note=" T "   />
<s d="&#x0075;" t="&#x0075;"  note=" U "   />
<s d="&#x016B;" t="&#x016B;"  note=" U WITH MACRON "   />
<s d="&#x0076;" t="&#x0076;"  note=" V "   />
<s d="&#x0077;" t="&#x0077;"  note=" W "   />
<s d="&#x0078;" t="&#x0078;"  note=" X "   />
<s d="&#x007A;" t="&#x007A;"  note=" Z "   />
<s d="&#x017E;" t="&#x017E;"  note=" Z WITH CARON "   />
</group> 
<group name="upper case letters" b="111"> 
<s d="&#x0041;" t="&#x0041;"  note=" A "   />
<s d="&#x0100;" t="&#x0100;"  note=" A WITH MACRON "   />
<s d="&#x0042;" t="&#x0042;"  note=" B "   />
<s d="&#x0043;" t="&#x0043;"  note=" C "   />
<s d="&#x010C;" t="&#x010C;"  note=" C WITH CARON "   />
<s d="&#x0044;" t="&#x0044;"  note=" D "   />
<s d="&#x0045;" t="&#x0045;"  note=" E "   />
<s d="&#x0112;" t="&#x0112;"  note=" E WITH MACRON "   />
<s d="&#x0046;" t="&#x0046;"  note=" F "   />
<s d="&#x0047;" t="&#x0047;"  note=" G "   />
<s d="&#x0122;" t="&#x0122;"  note=" G WITH CEDILLA "   />
<s d="&#x0048;" t="&#x0048;"  note=" H "   />
<s d="&#x0049;" t="&#x0049;"  note=" I "   />
<s d="&#x012A;" t="&#x012A;"  note=" I WITH MACRON "   />
<s d="&#x0059;" t="&#x0059;"  note=" Y "   />
<s d="&#x004A;" t="&#x004A;"  note=" J "   />
<s d="&#x004B;" t="&#x004B;"  note=" K "   />
<s d="&#x0136;" t="&#x0136;"  note=" K WITH CEDILLA "   />
<s d="&#x004C;" t="&#x004C;"  note=" L "   />
<s d="&#x013B;" t="&#x013B;"  note=" L WITH CEDILLA "   />
<s d="&#x004D;" t="&#x004D;"  note=" M "   />
<s d="&#x004E;" t="&#x004E;"  note=" N "   />
<s d="&#x0145;" t="&#x0145;"  note=" N WITH CEDILLA "   />
<s d="&#x004F;" t="&#x004F;"  note=" O "   />
<s d="&#x014C;" t="&#x014C;"  note=" O WITH MACRON "   />
<s d="&#x0050;" t="&#x0050;"  note=" P "   />
<s d="&#x0051;" t="&#x0051;"  note=" Q "   />
<s d="&#x0052;" t="&#x0052;"  note=" R "   />
<s d="&#x0156;" t="&#x0156;"  note=" R WITH CEDILLA "   />
<s d="&#x0053;" t="&#x0053;"  note=" S "   />
<s d="&#x0160;" t="&#x0160;"  note=" S WITH CARON "   />
<s d="&#x0054;" t="&#x0054;"  note=" T "   />
<s d="&#x0055;" t="&#x0055;"  note=" U "   />
<s d="&#x016A;" t="&#x016A;"  note=" U WITH MACRON "   />
<s d="&#x0056;" t="&#x0056;"  note=" V "   />
<s d="&#x0057;" t="&#x0057;"  note=" W "   />
<s d="&#x0058;" t="&#x0058;"  note=" X "   />
<s d="&#x005A;" t="&#x005A;"  note=" Z "   />
<s d="&#x017D;" t="&#x017D;"  note=" Z WITH CARON "   />
</group>
<group name="Numbers" b="113">
<s d="1" t="1"/>
<s d="2" t="2"/>
<s d="3" t="3"/>
<s d="4" t="4"/>
<s d="5" t="5"/>
<s d="6" t="6"/>
<s d="7" t="7"/>
<s d="8" t="8"/>
<s d="9" t="9"/>
<s d="0" t="0"/>
</group>
<group name="Punctuation" b="112">
<s d="%" t="%"/>
<s d="*" t="*"/>
<s d="+" t="+"/>
<s d="=" t="="/>
<s d="/" t="/"/>
<s d="#" t="#"/>
<s d="$" t="$"/>
<s d="|" t="|"/>
<s d="\" t="\"/>
<s d="~" t="~"/>
<s d="^" t="^"/>
<s d="_" t="_"/>
<s d="&amp;" t="&amp;"/>
<s d="@" t="@"/>
<s d="[" t="["/>
<s d="]" t="]"/>
<s d="{" t="{"/>
<s d="}" t="}"/>
<s d="&lt;" t="&lt;"/>
<s d="&gt;" t="&gt;"/>
<s d="(" t="("/>
<s d=")" t=")"/>
<s d="&quot;" t="&quot;"/>
<s d="`" t="`"/>
<s d="&apos;" t="&apos;"/>
<s d="-" t="-"/>
<s d=":" t=":"/>
<s d=";" t=";"/>
<s d="?" t="?"/>
<s d="!" t="!"/>
<s d="," t=","/>
<s d="." t="."/>
</group>
</alphabet>
</alphabets>
